"directory","file_name","variable_name","variable_type","description"
"data/","people.rda","project_id","character", "Unique identifier for each person using a combination of other metadata. Folder name on Google Drive."
"data/","people.rda","degree","character", "Categorical variable with four levels: bsc, msc, phd, staff."
"data/","people.rda","type","character", "Categorical variable with six levels: hiwi, intern, post-doc, scientific-assitant, sem-proj, thesis."
"data/","people.rda","b_m_student","character", "Binary variable to identify if person is BSc or MSc students. Levels: yes, no."
"data/","people.rda","start_date","Date", "Start date of the person."
"data/","people.rda","year","numeric", "Year of the start date."
"data/","people.rda","thesis_title","character", "Title of the thesis."
